{
  "contractVersion": "1.0.0",
  "id": "features.media-showcase",
  "title": "Wide media showcase",
  "category": "FEATURES",
  "description": "Header, one full-width image and optional text columns beneath.",
  "source": {
    "id": "src:selfhosted:17",
    "file": "site/src/components/SelfHosted.jsx",
    "tag": "export default function SelfHosted",
    "lines": "17-64",
    "alsoImplementedBy": [
      {
        "file": "site/src/components/features/blocks.jsx",
        "tag": "export function ImageBlock",
        "lines": "398-404"
      },
      {
        "file": "site/src/components/plans/Blocks.jsx",
        "tag": "export function WideImage",
        "lines": "485-496"
      }
    ]
  },
  "semantic": {
    "id": "features.media-showcase",
    "category": "FEATURES"
  },
  "retrievalEligible": true,
  "variants": [
    "dark-columns",
    "wide-image"
  ],
  "themes": [
    "light",
    "dark"
  ],
  "content": {
    "fields": {
      "eyebrow": {
        "type": "text",
        "maxWords": 6,
        "required": false,
        "copyBasis": "real-copy"
      },
      "title": {
        "type": "text",
        "maxWords": 16,
        "required": true,
        "copyBasis": "real-copy"
      },
      "body": {
        "type": "text",
        "maxWords": 45,
        "required": false,
        "copyBasis": "placeholder-length"
      },
      "actions": {
        "type": "ctaList",
        "maxItems": 2,
        "required": false
      },
      "media": {
        "type": "media",
        "required": true
      },
      "columns": {
        "type": "items",
        "maxItems": 4,
        "required": false,
        "fields": {
          "title": {
            "type": "text",
            "maxWords": 6,
            "required": true,
            "copyBasis": "real-copy"
          },
          "body": {
            "type": "text",
            "maxWords": 40,
            "required": false,
            "copyBasis": "placeholder-length"
          }
        }
      }
    }
  },
  "constraints": {},
  "motion": {
    "allowedPatterns": [
      "none"
    ],
    "reducedMotionFallbacks": {
      "none": "none"
    }
  },
  "responsive": [
    {
      "minWidthPx": 768,
      "breakpoint": "md",
      "change": "media-swap",
      "detail": "Mobile image variants (different aspect ratio) are used below 768.",
      "evidence": "CLONE_SPEC.md:653"
    },
    {
      "minWidthPx": 768,
      "breakpoint": "md",
      "change": "grid-columns",
      "detail": "Multi-column grids collapse to one column below 768.",
      "evidence": "CLONE_SPEC.md:653"
    }
  ],
  "assets": {
    "referenceAssetRoles": [
      "product-screenshot"
    ],
    "generatedAssetRoles": [
      "generated-product-visual"
    ]
  },
  "evidence": {
    "level": "measured",
    "measuredRouteCount": 4,
    "measuredHeightPx1440": {
      "min": 877,
      "max": 1061
    },
    "copyBudgetNote": "maxWords on real-copy fields bounds the measured real headings/labels; placeholder-length fields (inner-page paragraphs, long-form bodies, most FAQ answers) are sized from the clone placeholder character counts (ph(n): median 105, p90 162, max 636 chars), not from real copy."
  }
}
